{
  "schema_version": "0.1.0",
  "pack_id": "ce-1836-v1",
  "era": "1836",
  "start_date": "1836-01-01",
  "scenario_id": "official-1836",
  "display_name": "Central Europe 1836 period geometry v1",
  "quality_tier": "period-geometry",
  "priority_region": {
    "id": "central-europe",
    "label": "Central Europe",
    "parent_country_ids": ["AUT", "CZE", "POL", "HUN"],
    "bbox": [12.0, 45.5, 24.5, 55.0],
    "notes": "M20 second-era CE geometry. Austrian Empire / Hungarian lands / post-partition Polish residual readability for the Victoria-leaning 1836 start."
  },
  "geometry_modes": ["boundary_hints", "hard_overrides"],
  "period_true_scope": ["central-europe"],
  "scaffold_backed_scope": ["outside priority_region", "seas", "rest of world"],
  "source_notes": [
    "Curator-authored soft frontier bands and sample hard overrides for M20 multi-region period geometry.",
    "Not derived from proprietary game maps.",
    "Hard overrides target sample_* CE province IDs; they skip cleanly on full Natural Earth builds.",
    "Soft boundary hints are geographic and apply on any scaffold that intersects the priority region."
  ],
  "do_not_claim": [
    "period-correct province geometry worldwide",
    "Paradox-grade Austrian Empire / German Confederation microborders",
    "legal 1836 frontiers — hints are illustrative for the historical sniff test"
  ],
  "boundary_hints": [
    {
      "hint_id": "ce1836-austrian-empire-core",
      "label": "Austrian Empire core band",
      "kind": "frontier",
      "confidence": "illustrative",
      "related_tags": ["AUS"],
      "notes": "Soft band around the Vienna basin and Alpine fringe for Metternich-era readability.",
      "geometry": {
        "type": "LineString",
        "coordinates": [
          [14.5, 48.5],
          [15.5, 48.4],
          [16.5, 48.2],
          [17.0, 47.8],
          [16.5, 47.2]
        ]
      }
    },
    {
      "hint_id": "ce1836-galicia-corridor",
      "label": "Galician corridor band",
      "kind": "frontier",
      "confidence": "illustrative",
      "related_tags": ["AUS", "RUS"],
      "notes": "Illustrative band for Austrian Galicia / partition-era Polish lands story.",
      "geometry": {
        "type": "LineString",
        "coordinates": [
          [19.0, 50.5],
          [20.5, 50.2],
          [22.0, 49.8],
          [23.5, 49.5]
        ]
      }
    },
    {
      "hint_id": "ce1836-hungarian-lands",
      "label": "Hungarian lands under Habsburg",
      "kind": "frontier",
      "confidence": "illustrative",
      "related_tags": ["AUS", "HUN"],
      "notes": "Soft band for Kingdom of Hungary within the Austrian Empire frame.",
      "geometry": {
        "type": "LineString",
        "coordinates": [
          [16.5, 48.0],
          [17.5, 47.6],
          [18.5, 47.3],
          [19.5, 47.0],
          [20.5, 46.8]
        ]
      }
    },
    {
      "hint_id": "ce1836-bohemian-crownland",
      "label": "Bohemian crownland band",
      "kind": "disputed_band",
      "confidence": "illustrative",
      "related_tags": ["AUS"],
      "notes": "Soft band for Bohemia as Austrian crownland (not independent CZE).",
      "geometry": {
        "type": "Polygon",
        "coordinates": [
          [
            [13.8, 49.0],
            [16.2, 49.0],
            [16.2, 50.6],
            [13.8, 50.6],
            [13.8, 49.0]
          ]
        ]
      }
    }
  ],
  "hard_overrides": [
    {
      "operation": "replace",
      "scaffold_province_id": "sample_at_vienna",
      "era_province_id": "era_at_vienna_1836",
      "display_name": "Vienna (1836)",
      "reason": "Austrian Empire capital readability; modest footprint nudge on the CE sample.",
      "geometry": {
        "type": "Polygon",
        "coordinates": [
          [
            [15.55, 48.05],
            [16.85, 48.05],
            [16.85, 48.85],
            [15.55, 48.85],
            [15.55, 48.05]
          ]
        ]
      }
    },
    {
      "operation": "identity",
      "scaffold_province_id": "sample_cz_bohemia",
      "era_province_id": "sample_cz_bohemia",
      "reason": "Bohemia retained as scaffold shape; crownland story via soft band + politics."
    },
    {
      "operation": "identity",
      "scaffold_province_id": "sample_pl_mazovia",
      "era_province_id": "sample_pl_mazovia",
      "reason": "Mazovia retained; Congress Poland / partition story via politics + Galicia band."
    },
    {
      "operation": "identity",
      "scaffold_province_id": "sample_hu_pannon",
      "era_province_id": "sample_hu_pannon",
      "reason": "Hungarian plain retained; lands-under-Habsburg story via soft frontier."
    }
  ]
}
