{
  "schema_version": "0.1.0",
  "pack_id": "we-1936-v1",
  "era": "1936",
  "start_date": "1936-01-01",
  "scenario_id": "official-1936",
  "display_name": "Western Europe 1936 period geometry v1",
  "quality_tier": "period-geometry",
  "priority_region": {
    "id": "western-europe",
    "label": "Western Europe",
    "parent_country_ids": [
      "FRA",
      "BEL",
      "NLD",
      "LUX",
      "DEU"
    ],
    "bbox": [
      -5.5,
      42.0,
      12.0,
      54.0
    ],
    "notes": "M16 interwar era geometry pack. Maginot / Rhineland readability for the HOI-leaning 1936 start."
  },
  "geometry_modes": [
    "boundary_hints",
    "hard_overrides"
  ],
  "period_true_scope": [
    "western-europe"
  ],
  "scaffold_backed_scope": [
    "outside priority_region",
    "seas",
    "rest of world"
  ],
  "source_notes": [
    "Curator-authored soft frontier bands and sample hard overrides for M16 multi-era packs.",
    "Not derived from proprietary game maps.",
    "Hard overrides target beta sample province_ids (sample_*); they skip cleanly on full Natural Earth builds."
  ],
  "do_not_claim": [
    "period-correct province geometry worldwide",
    "Paradox-grade interwar microborders or Maginot fort blueprints",
    "legal 1936 frontiers \u2014 hints are illustrative for the historical sniff test"
  ],
  "boundary_hints": [
    {
      "hint_id": "we1936-maginot-band",
      "label": "Maginot Line corridor (illustrative)",
      "kind": "frontier",
      "confidence": "illustrative",
      "related_tags": [
        "FRA",
        "GER"
      ],
      "notes": "Soft band along the Franco-German frontier for interwar strategic readability.",
      "geometry": {
        "type": "LineString",
        "coordinates": [
          [
            5.8,
            47.6
          ],
          [
            6.5,
            48.2
          ],
          [
            7.2,
            48.8
          ],
          [
            7.8,
            49.2
          ],
          [
            8.1,
            49.0
          ]
        ]
      }
    },
    {
      "hint_id": "we1936-rhineland-dmz",
      "label": "Rhineland demilitarized / remilitarization band",
      "kind": "disputed_band",
      "confidence": "illustrative",
      "related_tags": [
        "GER"
      ],
      "notes": "Illustrative band for the Rhineland story at the 1936 start (demilitarized until March 1936).",
      "geometry": {
        "type": "Polygon",
        "coordinates": [
          [
            [
              6.0,
              49.3
            ],
            [
              7.6,
              49.3
            ],
            [
              7.6,
              51.6
            ],
            [
              6.0,
              51.6
            ],
            [
              6.0,
              49.3
            ]
          ]
        ]
      }
    },
    {
      "hint_id": "we1936-belgian-frontier",
      "label": "Belgian eastern frontier band",
      "kind": "frontier",
      "confidence": "illustrative",
      "related_tags": [
        "BEL",
        "GER"
      ],
      "notes": "Soft band near Eupen-Malmedy / Belgian-German frontier for interwar maps.",
      "geometry": {
        "type": "LineString",
        "coordinates": [
          [
            5.8,
            50.0
          ],
          [
            6.1,
            50.4
          ],
          [
            6.2,
            50.8
          ]
        ]
      }
    },
    {
      "hint_id": "we1936-channel-ports",
      "label": "Channel / North Sea ports band",
      "kind": "frontier",
      "confidence": "illustrative",
      "related_tags": [
        "FRA",
        "BEL",
        "NET"
      ],
      "notes": "Soft coastal band for Channel/North Sea strategic framing.",
      "geometry": {
        "type": "LineString",
        "coordinates": [
          [
            1.5,
            50.9
          ],
          [
            2.5,
            51.1
          ],
          [
            3.5,
            51.3
          ],
          [
            4.5,
            51.9
          ]
        ]
      }
    }
  ],
  "hard_overrides": [
    {
      "operation": "replace",
      "scaffold_province_id": "sample_de_rhineland",
      "era_province_id": "era_de_rhineland_1936",
      "display_name": "Rhineland (1936)",
      "reason": "Interwar Rhineland label + modest footprint for demilitarized zone readability on the WE sample.",
      "geometry": {
        "type": "Polygon",
        "coordinates": [
          [
            [
              6.45,
              50.45
            ],
            [
              7.55,
              50.45
            ],
            [
              7.55,
              51.55
            ],
            [
              6.45,
              51.55
            ],
            [
              6.45,
              50.45
            ]
          ]
        ]
      }
    },
    {
      "operation": "identity",
      "scaffold_province_id": "sample_fr_paris",
      "era_province_id": "sample_fr_paris",
      "reason": "Third Republic core retained."
    },
    {
      "operation": "identity",
      "scaffold_province_id": "sample_fr_normandy",
      "era_province_id": "sample_fr_normandy",
      "reason": "Normandy retained; Channel story via soft hints."
    },
    {
      "operation": "identity",
      "scaffold_province_id": "sample_be_flanders",
      "era_province_id": "sample_be_flanders",
      "reason": "Flanders retained as scaffold identity."
    },
    {
      "operation": "identity",
      "scaffold_province_id": "sample_nl_holland",
      "era_province_id": "sample_nl_holland",
      "reason": "Holland retained."
    },
    {
      "operation": "identity",
      "scaffold_province_id": "sample_lu_core",
      "era_province_id": "sample_lu_core",
      "reason": "Luxembourg retained."
    }
  ]
}
